Region,Lone father (all ages),Lone mother 0-17 and at least one child below 18,Lone mother 18-24 and at least one child below 18,Lone mother 25-34 and at least one child below 18,Lone mother 25-34 and all children 18 and over,Lone mother 35-59 and at least one child below 18,Lone mother 35-59 and all children 18 and over,Lone mother 60+ and at least one child below 18,Lone mother 60+ and all children 18 and over
Sub-Saharan Africa,15.8,0.3,6.1,23.7,0.1,40.1,6.9,1.8,5.2
Central and Southern Asia,15.1,0,2.2,19.1,0.1,37.2,18.3,0.7,7.4
Northern Africa and Western Asia,11.9,0.3,3.9,11.6,0,34.1,20,1.4,16.8
Latin America and the Caribbean,13.6,0.1,2.6,14.7,0.1,32.8,18.2,0.6,17.2
Europe and Northern America,16.6,0,3.1,15.3,0,31.1,17.7,0.2,16.1
World,15.7,0.1,3.3,17.5,0,35.5,15.4,0.9,11.6
