strain	gisaid_epi_isl	genbank_accession	originating_lab	submitting_lab	author
hCoV-19/Luxembourg/LNS2122915/2020	EPI_ISL_740063		Laboratoire national de santé, Microbiology, Virology	Laboratoire national de santé, Microbiology, Microbial Genomics Platform	Anke Wienecke-Baldacchino et al
hCoV-19/Madagascar/IPM-39472/2020	EPI_ISL_1660317		Virology Unit, Institut Pasteur de Madagascar	Virology Unit, Institut Pasteur de Madagascar	Marion Barbet et al
hCoV-19/Madagascar/IPM-00798/2021	EPI_ISL_1660303		Virology Unit, Institut Pasteur de Madagascar	Virology Unit, Institut Pasteur de Madagascar	Marion Barbet et al
hCoV-19/Ecuador/USFQ-1928/2021	EPI_ISL_3505582		Center for Research on Health in Latin America	Institute of Microbiology, Universidad San Francisco de Quito	Sully Márquez et al
hCoV-19/Ecuador/USFQ-1944/2021	EPI_ISL_3505584		Institute of Microbiology, Universidad San Francisco de Quito	Institute of Microbiology, Universidad San Francisco de Quito	Sully Márquez et al
hCoV-19/Turkey/KON-MER-02/2021	EPI_ISL_3399813		Necmettin Erbakan University, Meram Faculty of Medicine, Microbiology Laboratory	Massive Bioinformatics ARGE Technologies Company	Fatma Esenkaya Taşbent et al
hCoV-19/Switzerland/BL-ETHZ-590079/2021	EPI_ISL_1913280	OU171404.1	Viollier AG	Department of Biosystems Science and Engineering, ETH Zurich	Christian Beisel et al
hCoV-19/Kuwait/JAH3091526/2021	EPI_ISL_2556119		MOH - Jaber Al-Ahmad Hospital (Innovation Research Laboratory)	MOH - Jaber Al-Ahmad Hospital (Innovation Research Laboratory)	Salman Al-Sabah et al
hCoV-19/Ecuador/USFQ-1204/2021	EPI_ISL_2004106		Institute of Microbiology, Universidad San Francisco de Quito	Institute of Microbiology, Universidad San Francisco de Quito	Sully Márquez et al
hCoV-19/Spain/CL-COV05072/2021	EPI_ISL_2958315		SARS-CoV-2 Sequencing Castilla y Leon-Spain Consortium	SARS-CoV-2 Sequencing Castilla y Leon-Spain Consortium	Antonio Orduña-Domingo et al
hCoV-19/Italy/CAM-TIGEM-IZSM-COLLI-12238/2021	EPI_ISL_2153156		Istituto Zooprofilattico Sperimentale del Mezzogiorno	TIGEM	Antonio Grimaldi Patrizia Annunziata Francesco Panariello Biancamaria Pierri Claudia Tiberio Teresa Giuliano Valentina Bouche Chiara Colantuono Maria Concetta Cuomo Denise Di Concilio Lucio Di Filippo Anna Manfredi Marcello Salvi Antonio Limone Luigi Atripaldi Pellegrino Cerino Andrea Ballabio Davide Cacchiarelli et al
hCoV-19/Lithuania/LTU000_NMRVI_121353/2021	EPI_ISL_2614794		Nacionalinis maisto ir veterinarijos rizikos vertinimo institutas	National Public Health Surveillance Laboratory	Lukas Zemaitis et al
hCoV-19/Maldives/MAV16830/2021	EPI_ISL_3452729		Indira Gandhi Memorial Hospital	Indira Gandhi Memorial Hospital	Dr. Milza Abdul Muhsin et al
hCoV-19/Maldives/MAV22332/2021	EPI_ISL_3275168		AA. Himandhoo	Indira Gandhi Memorial Hospital	Dr. Milza Abdul Muhsin et al
hCoV-19/Maldives/MAV17718/2021	EPI_ISL_3452720		Indira Gandhi Memorial Hospital	Indira Gandhi Memorial Hospital	Dr. Milza Abdul Muhsin et al
hCoV-19/NewZealand/21CV0012/2021	EPI_ISL_794617		LabPLUS	Institute of Environmental Science and Research (ESR)	Xiaoyun Ren et al
hCoV-19/Australia/VIC18714/2021	EPI_ISL_2920963		Victorian Infectious Diseases Reference Laboratory (VIDRL)	VIDRL and MDU-PHL	Caly L. et al B
hCoV-19/Belgium/UZA-UA-CV2278359238/2021	EPI_ISL_2443402		Platform BIS UZA/UAntwerpen	Labo Klinische Biologie, UZA	Marie Le Mercier et al
hCoV-19/Argentina/INEIINBIRS-14/2021	EPI_ISL_2756558		Instituto de Investigaciones Biomédicas en Retrovirus y SIDA (INBIRS), Universidad de Buenos Aires (UBA)-CONICET, Buenos Aires, Argentina.	INEI - ANLIS. Instituto Nacional de Enfermedades Infecciosas, Administración Nacional de. Laboratorios e institutos de Salud "Dr. Carlos G. Malbran"/INBIRS.	Augusto Varese et al
hCoV-19/Argentina/PAIS-E0292/2021	EPI_ISL_3033073		Laboratorio Central de la Ciudad de Santa Fe	Grupo de Genómica y Bioinformática del Instituto de Investigación de la Cadena Láctea CONICET-INTA on behalf of 'Proyecto Argentino Interinstitucional de genomica de SARS-CoV-2' (PAIS Consortium)	Eberhardt et al
hCoV-19/Romania/Bucuresti_441047/2021	EPI_ISL_2017846		Viral Respiratory Infections Laboratory, Cantacuzino National Military-Medical Institute	Cantacuzino Institute Virology	Luiza Ustea et al
hCoV-19/Romania/Dolj_455019/2021	EPI_ISL_3021379		Clinical Emergency County Hospital, Craiova	Cantacuzino Institute Virology	Carmen Cherciu et al
hCoV-19/Australia/NSW4670/2021	EPI_ISL_2404989		Area of Virology, Serology and Virology Division (SAViD), New South Wales Health Pathology Randwick	Virology Research Laboratory; Area of Virology, Serology and Virology Division (SAViD), New South Wales Health Pathology Randwick	Foster et al
hCoV-19/Australia/NT150/2021	EPI_ISL_2321158		Royal Darwin Hospital Pathology	MDU-PHL	Meumann et al
hCoV-19/Denmark/DCGC-91015/2021	EPI_ISL_2027305		Department of Virus and Microbiological Special Diagnostics, Statens Serum Institut, Copenhagen, Denmark	Aalborg University	Danish Covid-19 Genome Consortium et al
hCoV-19/NewZealand/21MV0397/2021	EPI_ISL_1967897		LabPLUS	Institute of Environmental Science and Research (ESR)	Rachel Boyle et al
hCoV-19/CostaRica/INC-0654/2021	EPI_ISL_2502751		AREA DE SALUD PAQUERA	Inciensa, Instituto Costarricense de InvestigaciOn y Enseñanza en NutriciOn y Salud	Francisco Duarte et al
hCoV-19/Bangladesh/BCSIR-SUST-13/2021	EPI_ISL_1547365		Department of Genetic Engineering and Biotechnology, Shahjalal University of Science and Technology	Genomic Research Lab, BCSIR	Iffat Jahan et al
hCoV-19/Belgium/rega-8548/2021	EPI_ISL_2833407		KU Leuven, Rega Institute, Clinical and Epidemiological Virology	KU Leuven, Rega Institute, Clinical and Epidemiological Virology	Tony Wawina-Bokalanga et al
hCoV-19/Kosovo/ChVir25780_2/2021	EPI_ISL_2833651		Department of Microbiology, National Institute for Public Health of Kosova	Charité Universitätsmedizin Berlin, Institut für Virologie	Victor M Corman et al B
hCoV-19/Turkey/HSGM-2187/2021	EPI_ISL_1082392		Ministry of Health Turkey	Ministry of Health Turkey	Fatma Bayrakdar et al
hCoV-19/Israel/CVL-9317/2021	EPI_ISL_2084392		Israel Central Virology laboratory	Israel National Consortium for SARS-CoV-2 sequencing	Neta Zuckerman et al
hCoV-19/Canada/NL-NML-97342/2021	EPI_ISL_3150966		NL-Dr. Leonard A. Miller Centre for Health Services	National Microbiology Laboratory (NML)	Anna Majer et al
hCoV-19/Israel/CVL-13509/2021	EPI_ISL_2183740		Israel Central Virology laboratory	Israel National Consortium for SARS-CoV-2 sequencing	Neta Zuckerman et al
hCoV-19/Israel/CVL-13221/2021	EPI_ISL_2183390		Israel Central Virology laboratory	Israel National Consortium for SARS-CoV-2 sequencing	Neta Zuckerman et al
hCoV-19/USA/AK-PHL9856/2021	EPI_ISL_2966440		Alaska State Virology Laboratory	Alaska State Virology Laboratory	Stephanie DeRonde et al
hCoV-19/Aruba/AW-RIVM-29775/2021	EPI_ISL_1962242		Dutch COVID-19 response team	National Institute for Public Health and the Environment (RIVM)	Adam Meijer et al
hCoV-19/USA/CT-Yale-5665/2021	EPI_ISL_2776208		Yale Clinical Virology Lab	Grubaugh Lab - Yale School of Public Health	Joseph Fauver et al
hCoV-19/Palestine/AAS67/2021	EPI_ISL_2107516	MZ207864.1	Biochemistry and Molecular Biology Department-Faculty of Medicine, Al-Quds University	Biochemistry and Molecular Biology Department-Faculty of Medicine, Al-Quds University	Ereqat et al
hCoV-19/Palestine/AAS59/2021	EPI_ISL_1502579	MW858246.1	Biochemistry and Molecular Biology Department-Faculty of Medicine, Al-Quds University	Biochemistry and Molecular Biology Department-Faculty of Medicine, Al-Quds University	Nasereddin et al
hCoV-19/Palestine/AAS72/2021	EPI_ISL_2107520	MZ207868.1	Medical Laboratory Sciences, Arab American University	Medical Laboratory Sciences, Arab American University	Al-Jawabreh et al
hCoV-19/Israel/CVL-13715/2021	EPI_ISL_2636239		Israel Central Virology laboratory	Israel National Consortium for SARS-CoV-2 sequencing	Neta Zuckerman et al
hCoV-19/Israel/CVL-12116/2021	EPI_ISL_2182133		Israel Central Virology laboratory	Israel National Consortium for SARS-CoV-2 sequencing	Neta Zuckerman et al
hCoV-19/Israel/CVL-12895/2021	EPI_ISL_2183230		Israel Central Virology laboratory	Israel National Consortium for SARS-CoV-2 sequencing	Neta Zuckerman et al
hCoV-19/Ireland/RN-NVRL-22IRL53580/2021	EPI_ISL_2088113		National Virus Reference Laboratory	National Virus Reference Laboratory	Zoe Yandle et al
hCoV-19/CostaRica/INC-0668/2021	EPI_ISL_2658265		AREA DE SALUD CAÑAS	Inciensa, Instituto Costarricense de Investigación y Enseñanza en Nutrición y Salud	Francisco Duarte et al
hCoV-19/CostaRica/INC-0796/2021	EPI_ISL_3037828		AREA DE SALUD SAN ISIDRO	Inciensa, Instituto Costarricense de Investigación y Enseñanza en Nutrición y Salud	Francisco Duarte et al
hCoV-19/Bulgaria/21BG-NC_003457_R13/2021	EPI_ISL_2841962		National Center of Infectious and Parasitic Diseases	National Center of Infectious and Parasitic Diseases	Alexiev et al
hCoV-19/Sweden/10064892/2021	EPI_ISL_2205654		Swedish national genomic surveillance program of SARS-CoV-2	The Public Health Agency of Sweden	Maximilian Riess et al
hCoV-19/Australia/VIC18524/2021	EPI_ISL_2250228		Microbiological Diagnostic Unit - Public Health Laboratory (MDU-PHL)	Microbiological Diagnostic Unit Public Health Laboratory (MDU-PHL)	Seemann T. et al
hCoV-19/Belgium/ULG-12174/2021	EPI_ISL_1058442		SYNLAB - Laboratoire J. Collard	GIGA Medical Genomics	Keith Durkin et al
hCoV-19/DRC/254728/2021	EPI_ISL_2135838		Viral Respiratory Lab, National Institute for Biomedical Research (INRB)	Pathogen Sequencing Lab, National Institute for Biomedical Research (INRB)	Placide Mbala-Kingebeni et al
hCoV-19/Norway/11848/2021	EPI_ISL_2333374		Medical Microbiology Unit, Department for Laboratory Medicine, Drammen Hospital, Vestre Viken Health Trust,	Norwegian Institute of Public Health, Department of Virology	'Kathrine Stene-Johansen et al
hCoV-19/Norway/13667/2021	EPI_ISL_2612220		Akershus University Hospital, Department for Microbiology and Infectious Disease Control	Norwegian Institute of Public Health, Department of Virology	Kathrine Stene-Johansen et al
hCoV-19/Australia/SA0724/2021	EPI_ISL_2462362		SA Pathology	SA Pathology	Caitlin Selway et al
hCoV-19/USA/NJ-CDC-ASC210034174/2021	EPI_ISL_2089518	MZ195252.1	Aegis Sciences Corporation	Centers for Disease Control and Prevention Division of Viral Diseases, Pathogen Discovery	Dakota Howard et al
hCoV-19/NewZealand/20CV0687/2020	EPI_ISL_755626		PathLab Bay of Plenty	Institute of Environmental Science and Research (ESR)	Xiaoyun Ren et al
hCoV-19/Finland/HEL4-36/2020	EPI_ISL_833205		Department of Virology and Immunology, University of Helsinki and Helsinki University Hospital, Huslab Finland	Department of Virology, Faculty of Medicine, University of Helsinki, Helsinki, Finland	Teemu Smura et al
hCoV-19/SouthKorea/KDCA2872/2021	EPI_ISL_1622353		Division of Emerging Infectious Diseases, Bureau of Infectious Diseases Diagnosis Control, Korea Disease Control and Prevention Agency	Division of Emerging Infectious Diseases, Bureau of Infectious Diseases Diagnosis Control, Korea Disease Control and Prevention Agency	Ae Kyung Park et al
hCoV-19/Estonia/16282679/2021	EPI_ISL_2546996		Synlab Eesti OÜ	1. Laboratory of Communicable Diseases (Estonia); 2. Eurofins Genomics Europe Sequencing GmbH	Liidia Dotsenko et al.
hCoV-19/SintMaarten/SX-RIVM-38087/2021	EPI_ISL_2475174		Dutch COVID-19 response team	National Institute for Public Health and the Environment (RIVM)	Adam Meijer et al
hCoV-19/USA/NH-CDC-QDX25848334/2021	EPI_ISL_2870994	MZ538072.1	Quest Diagnostics Incorporated	Centers for Disease Control and Prevention Division of Viral Diseases, Pathogen Discovery	Dakota Howard et al
hCoV-19/USA/NY-PRL-2021_0426_02C16/2021	EPI_ISL_1827978		Pandemic Response Lab - NYC	Pandemic Response Lab, R&D	Henry Lee et al
hCoV-19/Latvia/2104095147/2021	EPI_ISL_2798196		Centrālā Laboratorija, SIA	Riga East University Hospital, National Microbiology Reference Laboratory; Eurofins Genomics Europe Sequencing GmbH	Stella Lapiņa et al
hCoV-19/Spain/CT-HUB00453/2021	EPI_ISL_1963969		Hospital Universitari Bellvitge	Microbiology Department	Sara Marti et al
hCoV-19/Romania/Mures_PV_412183/2021	EPI_ISL_1840250		Pro-Vitam Diagnostics and Research Laboratory	Pro-Vitam Diagnostics and Research Laboratory	Szilard N. Fejer et al
hCoV-19/USA/MT-MTPHL-3799385/2021	EPI_ISL_2421256		Montana Public Health Laboratory	Montana Public Health Laboratory	Joy Ritter et al
hCoV-19/Canada/SK-NML-123329/2021	EPI_ISL_3534764		SK-Roy Romanow Provincial Laboratory	National Microbiology Laboratory (NML)	Anna Majer et al
hCoV-19/Ireland/D-NVRL-22IRL32124/2021	EPI_ISL_1891351		National Virus Reference Laboratory	National Virus Reference Laboratory	Zoe Yandle et al
hCoV-19/Kuwait/KU-12005/2021	EPI_ISL_2429124		Mubarak Al-Kabeer Hospital	Virology Unit, Department of Microbiology, Faculty of Medicine, Kuwait University	Nada Madi et al
hCoV-19/Spain/CM-IBV-97027717/2021	EPI_ISL_2171623		Hospital Universitario de Guadalajara	SeqCOVID-SPAIN consortium/IBV(CSIC)	Alejandro González Praetorius y Mariela Martínez Ramírez et al
hCoV-19/Ireland/LK-NVRL-Q23IRL67867/2021	EPI_ISL_2649722		National Virus Reference Laboratory	National Virus Reference Laboratory	Zoe Yandle et al
hCoV-19/Ireland/D-NVRL-90IRL40319/2021	EPI_ISL_2241217		National Virus Reference Laboratory	National Virus Reference Laboratory	Zoe Yandle et al
hCoV-19/Ireland/U-NVRL-G21IRL69412/2021	EPI_ISL_3011445		National Virus Reference Laboratory	National Virus Reference Laboratory	Zoe Yandle et al
hCoV-19/Bahrain/341725942/2021	EPI_ISL_1660464	MW947241.1	Communicable Disease Laboratory, Public Health Directorate	Communicable Disease Laboratory, Public Health Directorate	Alwasti et al
hCoV-19/Burundi/UG523/2021	EPI_ISL_2928007		National Institute of Public Health, Bujumbura,Burundi, MRC/UVRI & LSHTM Uganda Research Unit	MRC/UVRI & LSHTM Uganda Research Unit, National Institute of Public Health	Jerome Nkurunziza et al
hCoV-19/Greece/210297/2021	EPI_ISL_2365329		Laboratory of Immunohematology, Division of Hematology	Greek Genome Center, Biomedical Research Foundation of the Academy of Athens (BRFAA)	Emmanouil Athanasiadis et al
hCoV-19/Greece/201397/2021	EPI_ISL_2371047		ETHNIKO KENTRO AIMODOSIAS E.KE.A.	Greek Genome Center, Biomedical Research Foundation of the Academy of Athens (BRFAA)	Emmanouil Athanasiadis et al
hCoV-19/Switzerland/AG-ETHZ-581188/2021	EPI_ISL_1749853	OU174322.1	Viollier AG	Department of Biosystems Science and Engineering, ETH Zürich	Chaoran Chen et al
hCoV-19/Luxembourg/LNS8535402/2021	EPI_ISL_3145267		BioneXt Lab	Laboratoire national de sante, Microbiology, Microbial Genomics Platform	Anke Wienecke-Baldacchino et al
hCoV-19/France/PDL-IPP13962/2021	EPI_ISL_2612616		Labo Analyses Med	National Reference Center for Viruses of Respiratory Infections, Institut Pasteur, Paris	Marion Barbet et al
hCoV-19/France/PDL-IPP11348/2021	EPI_ISL_2030158		Labo Analyses Med	National Reference Center for Viruses of Respiratory Infections, Institut Pasteur, Paris	Marion Barbet et al
hCoV-19/Bulgaria/21BG-EU_002927_Pl26/2021	EPI_ISL_2621372		National Center of Infectious and Parasitic Diseases	National Center of Infectious and Parasitic Diseases	Alexiev et al
hCoV-19/Bulgaria/21BG-EU_002906_Pl26/2021	EPI_ISL_2621353		National Center of Infectious and Parasitic Diseases	National Center of Infectious and Parasitic Diseases	Alexiev et al
hCoV-19/Qatar/QA.QU_18.14.E3/2021	EPI_ISL_2408357		Ministry of Public Health / Hamad Medical Corporation	Biomedical Research Center (BRC), Qatar University / Qatar Genome Project (QGP)	BRC: Fatiha M. Benslimane et al
hCoV-19/Australia/SA0672/2021	EPI_ISL_1704802		SA Pathology	SA Pathology	Lex Leong et al
hCoV-19/NewZealand/21MV0280/2021	EPI_ISL_1621311		Middlemore Hospital	Institute of Environmental Science and Research (ESR)	Rachel Boyle et al
hCoV-19/Australia/VIC18461/2021	EPI_ISL_2920928		Victorian Infectious Diseases Reference Laboratory (VIDRL)	VIDRL and MDU-PHL	Caly L. et al B
hCoV-19/Australia/WA681/2021	EPI_ISL_1669120		PathWest Laboratory Medicine WA	PathWest Laboratory Medicine WA Microbial Surveillance Unit	PathWest Laboratory Medicine WA Microbial Surveillance Unit et al
hCoV-19/Australia/WA698/2021	EPI_ISL_1816919		PathWest Laboratory Medicine WA	PathWest Laboratory Medicine WA Microbial Surveillance Unit	PathWest Laboratory Medicine WA Microbial Surveillance Unit et al
hCoV-19/USA/DE-B1090631/2021	EPI_ISL_2383750		DPHL	Delaware Public Health Lab	Rebecca Savage et al
hCoV-19/Iraq/Samawa-26/2021	EPI_ISL_1524355	MZ145312.1	Biology Department, College of Science, Al Muthanna University and Public Health Laboratory, Al-Muthanna Health Directorate	Department of Virology, Faculty of Medicine, University of Helsinki, Helsinki, Finland	Nihad Al-Rashedi et al
hCoV-19/Lebanon/QIB-897/2021	EPI_ISL_3344063		Laboratory of Molecular Biology and Cancer Immunology	Quadram Institute Bioscience	Georgi Merhi et al
hCoV-19/Bahrain/NPS-12/2021	EPI_ISL_2812541	MZ457941.1	Communicable Disease Laboratory, Public Health Directorate	Communicable Disease Laboratory, Public Health Directorate	Alwasti et al
hCoV-19/Philippines/PH-PGC-47061/2021	EPI_ISL_2859197		Baguio General Hospital Medical Center (BGHMC)	Philippine Genome Center	Francis A. Tablizo et al
hCoV-19/NorthernMarianaIslands/MP-CDC-2-4392999/2021	EPI_ISL_2383896	MZ331023.1	Commonwealth Healthcare Center	Centers for Disease Control and Prevention Division of Viral Diseases, Pathogen Discovery	Mili Sheth et al
hCoV-19/USA/GU-CDC-2-4651466/2021	EPI_ISL_3241988	MZ709089.1	Guam Public Health Laboratory	Centers for Disease Control and Prevention Division of Viral Diseases, Pathogen Discovery	Mili Sheth et al
hCoV-19/USA/GU-CDC-2-4611176/2021	EPI_ISL_3355177	MZ780676.1	Guam Public Health Laboratory	Centers for Disease Control and Prevention Division of Viral Diseases, Pathogen Discovery	Mili Sheth et al
hCoV-19/Australia/NSW1561/2021	EPI_ISL_1904471		South Eastern Area Laboratory Services (SEALS)	NSW Health Pathology - Institute of Clinical Pathology and Medical Research; Westmead Hospital; University of Sydney	CIDM-PH et al.
hCoV-19/Mexico/CAM_INER_IMSS_1117/2021	EPI_ISL_2490327		Unidad de Investigación Médica de Yucatán (UIMY)	Centro de Investigación en Enfermedades Infecciosas (CIENI), Instituto Nacional de Enfermedades Respiratorias (INER)	Consorcio Mexicano de Vigilancia Genómica (CoViGen-Mex). Authors (in alphabetical order): Julio Elias Alvarado-Yaah et al
hCoV-19/Greece/17276/2021	EPI_ISL_3045257		Central Public Health Laboratory, National Public Health Organization	Central Public Health Laboratory, National Public Health Organization	Kyriaki Tryfinopoulou et al
hCoV-19/USA/FL-CDC-LC0062331/2021	EPI_ISL_2399227	MZ342389.1	Laboratory Corporation of America	Centers for Disease Control and Prevention Division of Viral Diseases, Pathogen Discovery	Dakota Howard et al
hCoV-19/USA/IL-S21WGS1333/2021	EPI_ISL_2000806		Illinois Department of Public Health - Springfield Lab	Illinois Department of Public Health - Springfield Lab	Bryan Sim et al
hCoV-19/USA/PR-CDC-S511/2021	EPI_ISL_2688319		Puerto Rico Department of Health	Centers for Disease Control and Prevention, Dengue Branch	Gilberto A. Santiago et al
hCoV-19/USA/RI-CDC-2-4595043/2021	EPI_ISL_2987099	MZ572340.1	RI State Health Laboratories	Centers for Disease Control and Prevention Division of Viral Diseases, Pathogen Discovery	Mili Sheth et al
hCoV-19/USA/WI-UW-5333/2021	EPI_ISL_2713056		University of Wisconsin-Madison AIDS Vaccine Research Laboratories	University of Wisconsin-Madison AIDS Vaccine Research Laboratories	Gage Moreno et al
hCoV-19/Spain/CL-COV04458/2021	EPI_ISL_2957758		SARS-CoV-2 Sequencing Castilla y Leon-Spain Consortium	SARS-CoV-2 Sequencing Castilla y Leon-Spain Consortium	Antonio Orduña-Domingo et al
hCoV-19/Spain/CL-COV02845/2021	EPI_ISL_2649529		SARS-CoV-2 Sequencing Castilla y Leon-Spain Consortium	SARS-CoV-2 Sequencing Castilla y Leon-Spain Consortium	Antonio Orduña-Domingo et al
hCoV-19/Djibouti/NAMRU3_A104/2021	EPI_ISL_2858619	MZ520054.1	Naval Medical Research Unit No. 3	Naval Medical Research Center Biological Defense Research Directorate	Catherine E. Arnold et al
hCoV-19/Australia/NSW1585/2021	EPI_ISL_2462426		Sydney South West Pathology Service (SSWPS) - Royal Prince Alfred Hospital - NSW Health Pathology	NSW Health Pathology - Institute of Clinical Pathology and Medical Research; Westmead Hospital; University of Sydney	CIDM-PH et al.
hCoV-19/Kenya/SS388/2021	EPI_ISL_2603079		KEMRI-Wellcome Trust Research Programme,Kilifi	KEMRI-Wellcome Trust Research Programme,Kilifi	Githinji G. et al
hCoV-19/Kenya/C98175/2021	EPI_ISL_2602742		KEMRI-Wellcome Trust Research Programme,Kilifi	KEMRI-Wellcome Trust Research Programme,Kilifi	Githinji G. et al
hCoV-19/Kenya/C99511/2021	EPI_ISL_3049434		KEMRI-Wellcome Trust Research Programme,Kilifi	KEMRI-Wellcome Trust Research Programme,Kilifi	Githinji G. et al
hCoV-19/Kenya/SS416/2021	EPI_ISL_2603103		KEMRI-Wellcome Trust Research Programme,Kilifi	KEMRI-Wellcome Trust Research Programme,Kilifi	Githinji G. et al
hCoV-19/Australia/NT97/2020	EPI_ISL_779413		Royal Darwin Hospital Pathology	MDU-PHL	Meumann et al
hCoV-19/Jordan/UK5/2020	EPI_ISL_904015		Molecular Biology and Virology lab, Faculty of Veterinary Medicine, Jordan University of Science and Technology	Molecular Biology and Virology lab, Faculty of Veterinary Medicine, Jordan University of Science and Technology	Mohammad Hussien Alboom et al
hCoV-19/Bulgaria/21BG-NC_003500_R13/2021	EPI_ISL_2841987		National Center of Infectious and Parasitic Diseases	National Center of Infectious and Parasitic Diseases	Alexiev et al
hCoV-19/NewZealand/21MV0369/2021	EPI_ISL_1904856		LabPLUS	Institute of Environmental Science and Research (ESR)	Rachel Boyle et al
hCoV-19/Australia/SA0697/2021	EPI_ISL_2462341		SA Pathology	SA Pathology	Caitlin Selway et al
hCoV-19/Australia/SA0723/2021	EPI_ISL_2462361		SA Pathology	SA Pathology	Caitlin Selway et al
hCoV-19/Australia/SA0695/2021	EPI_ISL_2462339		SA Pathology	SA Pathology	Caitlin Selway et al
hCoV-19/NewZealand/21MV0367/2021	EPI_ISL_1904860		LabPLUS	Institute of Environmental Science and Research (ESR)	Rachel Boyle et al
hCoV-19/Netherlands/LI-SQD-00231/2021	EPI_ISL_3654257		Sanquin B.V.	Sanquin B.V.	Karin van Leeuwen et al
hCoV-19/Ireland/LK-NVRL-M30IRL97982/2021	EPI_ISL_2710635		National Virus Reference Laboratory	National Virus Reference Laboratory	Zoe Yandle et al
hCoV-19/Latvia/2104096527/2021	EPI_ISL_2798222		Riga East University Hospital, National Microbiology Reference Laboratory	Riga East University Hospital, National Microbiology Reference Laboratory; Eurofins Genomics Europe Sequencing GmbH	Ģirts Šķenders et al
hCoV-19/Latvia/2105069514/2021	EPI_ISL_2798859		Centrālā Laboratorija, SIA	Riga East University Hospital, National Microbiology Reference Laboratory; Eurofins Genomics Europe Sequencing GmbH	Stella Lapiņa et al
hCoV-19/SaintLucia/74394/2021	EPI_ISL_2967979		The Caribbean Public Health Agency	Carrington Lab, Department of Preclinical Sciences, Faculty of Medical Sciences, The University of the West Indies, St Augustine Campus	Nikita S. D. Sahadeo et al
hCoV-19/SaintLucia/74401/2021	EPI_ISL_2967984		The Caribbean Public Health Agency	Carrington Lab, Department of Preclinical Sciences, Faculty of Medical Sciences, The University of the West Indies, St Augustine Campus	Nikita S. D. Sahadeo et al
hCoV-19/SaintLucia/66444/2021	EPI_ISL_2626658		The Caribbean Public Health Agency	Carrington Lab, Department of Preclinical Sciences, Faculty of Medical Sciences, The University of the West Indies	Nikita S. D. Sahadeo et al
hCoV-19/AntiguaandBarbuda/77143/2021	EPI_ISL_3642758		The Caribbean Public Health Agency	Carrington Lab, Department of Preclinical Sciences, Faculty of Medical Sciences, The University of the West Indies, St Augustine Campus	Nikita S. D. Sahadeo et al
hCoV-19/Argentina/INEI104652/2021	EPI_ISL_2158775		Servicio Virosis Respiratorias-Departamento Virología-INEI	Instituto Nacional Enfermedades Infecciosas C.G.Malbran	Baumeister E. et al
hCoV-19/USA/KS-KHEL-1283/2021	EPI_ISL_1921872		Wichita State University - Molecular Diagnostics Lab	Kansas Health and Environmental Lab	Mike Grose et al
hCoV-19/USA/OR-OSPHL01324/2021	EPI_ISL_3048136		Oregon State Public Health Laboratory	Oregon State Public Health Laboratory	Rafia Razzaque et al
hCoV-19/USA/ID-IBL-726559/2021	EPI_ISL_3217264		Idaho Bureau of Laboratories	Idaho Bureau of Laboratories	"R. Beukelman et al
hCoV-19/USA/WY-WYPHL-21042641/2021	EPI_ISL_2712920		Wyoming Public Health Laboratory	Wyoming Public Health Laboratory	Jim Mildenberger et al
hCoV-19/USA/NC-CDC-STM-000068695/2021	EPI_ISL_2247979	MZ279249.1	Helix/Illumina	Centers for Disease Control and Prevention Division of Viral Diseases, Pathogen Discovery	Dakota Howard et al
hCoV-19/Mexico/COL_LANGEBIO_IMSS_0767/2021	EPI_ISL_2402178		Centro de Investigación Biomédica de Occidente (CIBO)	Unidad de Genomica Avanzada	Consorcio Mexicano de Vigilancia Genomica (CoViGen-Mex). Authors (in alphabetical order): Julio Elias Alvarado-Yaah et al
hCoV-19/USA/ID-UNM-IBL732802/2021	EPI_ISL_2934941		Idaho Bureau of Laboratories	Center for Global Health, University of New Mexico Health Sciences Center	Daryl Domman et al
hCoV-19/USA/VI-CDC-2-4420272/2021	EPI_ISL_2384232	MZ331322.1	VI-US Virgin Islands Department of Health	Centers for Disease Control and Prevention Division of Viral Diseases, Pathogen Discovery	Mili Sheth et al
hCoV-19/Bahamas/33423/2021	EPI_ISL_2982858		Reference Laboratory of the Ministry of Health Royal Victoria Gardens	Laboratory of Respiratory Viruses and Measles, Oswaldo Cruz Institute, FIOCRUZ	Paola Resende et al B
hCoV-19/USA/OK-CDC-LC0056251/2021	EPI_ISL_2046508	MZ181752.1	Laboratory Corporation of America	Centers for Disease Control and Prevention Division of Viral Diseases, Pathogen Discovery	Dakota Howard et al
